_id,Tool Name,Description,Usage Guidelines,Benefits,Cost,Manufacturer,Warranty Period,Maintenance Requirements,User Ratings,Recommended For,Weight,Operating Speed,Compatibility,ROI,Training Requirements,Crops,Growth Stage,Soil Requirements
66fd2075bb1d40464e7b4cb7,Smart Irrigation System,An automated system that optimizes watering based on soil moisture levels.,Install sensors in the field and connect to the control unit. Set the desired moisture levels.,"Reduces water usage, increases crop yield, and minimizes labor.",1200,AgriTech Co.,2 years,Regular sensor checks,4.5,"Vegetables, Fruits",25 kg,5 acres/hour,Yes,15%,None,"Rice, Corn",Germination to Harvest,"Well-drained, Moisture-retentive"
66fd2075bb1d40464e7b4cb8,Drones for Crop Monitoring,Drones equipped with cameras for aerial monitoring of crop health.,Fly the drone over the field and capture images for analysis.,Improves monitoring efficiency and identifies issues early.,1500,SkyFarmers,1 year,Battery replacement annually,4.7,All crops,2 kg,20 acres/hour,Yes,20%,Basic flight training,"Soybean, Wheat",All stages,"Well-drained, Nutrient-rich"
66fd2075bb1d40464e7b4cb9,Soil Moisture Sensor,A device that measures soil moisture levels to optimize irrigation.,Place sensors in the soil and monitor moisture levels via an app.,Helps in precise irrigation and conserves water.,300,MoistureTech,3 years,Calibrate every season,4.6,Vegetables,1 kg,N/A,No,30%,None,"Tomato, Lettuce",All stages,"Sandy loam, Moist"
66fd2075bb1d40464e7b4cba,Planting Robot,"A robot that automates the planting process, ensuring optimal depth and spacing.",Set the planting parameters and let the robot plant seeds.,Increases planting speed and reduces labor costs.,20000,RoboAgri,5 years,Regular software updates,4.8,"Grains, Vegetables",300 kg,2 acres/hour,Yes,25%,Operator training,"Wheat, Barley",Planting Stage,"Well-drained, Fertile"
66fd2075bb1d40464e7b4cbb,Harvesting Machine,A machine designed to efficiently harvest crops like grains and fruits.,Drive the machine through the fields for automatic harvesting.,Increases harvesting efficiency and reduces manual labor.,25000,HarvestPro,2 years,Daily cleaning,4.5,"Grains, Fruits",1200 kg,5 acres/hour,Yes,18%,None,"Corn, Apple",Harvest Stage,"Firm, Well-drained"
66fd2075bb1d40464e7b4cbc,Crop Protection Sprayer,A machine that sprays pesticides and fertilizers uniformly across crops.,Load the sprayer with chemicals and operate it in the field.,Ensures uniform application and reduces chemical wastage.,1500,SprayTech,1 year,Monthly maintenance check,4.3,All crops,50 kg,2 acres/hour,Yes,22%,None,All crops,All stages,Varies by crop
66fd2075bb1d40464e7b4cbd,Weeding Robot,An autonomous robot that identifies and removes weeds from fields.,Deploy the robot in the fields to automatically remove weeds.,Reduces the need for chemical herbicides and labor.,12000,WeedFree,3 years,Clean sensors weekly,4.9,All crops,50 kg,1 acre/hour,Yes,30%,None,Vegetables,All stages,"Well-drained, Fertile"
66fd2075bb1d40464e7b4cbe,Precision Seeder,A seeder that ensures precise placement of seeds in the soil.,Adjust the settings and let the machine plant seeds.,Improves seed placement and optimizes crop density.,1800,SeedTech,2 years,Calibrate before planting,4.6,"Grains, Vegetables",80 kg,3 acres/hour,No,20%,None,"Corn, Rice",Planting Stage,"Fertile, Well-drained"
66fd2075bb1d40464e7b4cbf,Post-Harvest Processing Machine,A machine that processes harvested crops for storage and sale.,Feed the harvested crops into the machine for processing.,Enhances crop quality and reduces post-harvest losses.,8000,ProcessMaster,3 years,Monthly maintenance,4.4,All crops,400 kg,N/A,Yes,25%,Training required,All crops,Post-harvest Stage,Varies by crop
66fd2075bb1d40464e7b4cc0,Mobile Weather Station,A portable device that monitors weather conditions in real-time.,Set up the station in the field to track local weather.,Helps in making informed decisions based on weather patterns.,2000,WeatherTech,1 year,Battery check every month,4.5,All crops,5 kg,N/A,Yes,20%,None,All crops,All stages,N/A
66fd2075bb1d40464e7b4cc1,Automatic Fertilizer Spreader,Spreads fertilizers uniformly over the field.,Fill with fertilizer and set the desired spread rate.,"Ensures even distribution, enhancing growth.",1000,FertilizerPro,2 years,Clean after each use,4.5,All crops,100 kg,1 acre/hour,Yes,15%,None,"Corn, Soybean",Growing Stage,"Fertile, Well-drained"
66fd2075bb1d40464e7b4cc2,Smart Pest Monitoring Device,Monitors pest levels using sensors and alerts farmers.,Place devices in fields to track pest activity.,"Helps in timely intervention, reducing crop losses.",700,PestControl,1 year,Battery replacement yearly,4.6,All crops,2 kg,N/A,No,20%,None,"Tomato, Grapes",All stages,N/A
66fd2075bb1d40464e7b4cc3,Automated Weather Station,Measures weather variables and sends data to a mobile app.,Install in a location with good exposure to weather.,Provides real-time data for better decision-making.,2500,WeatherTech,2 years,Monthly checks,4.8,All crops,10 kg,N/A,Yes,25%,Basic setup training,All crops,All stages,N/A
66fd2075bb1d40464e7b4cc4,High-Efficiency Tiller,Breaks up soil to prepare for planting.,Use the tiller to break soil before planting.,Improves soil aeration and enhances root growth.,2000,TillTech,3 years,Regular oil changes,4.7,"Vegetables, Fruits",150 kg,N/A,Yes,22%,None,"Carrot, Beetroot",Pre-planting Stage,"Loamy, Well-drained"
66fd2075bb1d40464e7b4cc5,Organic Pest Control Kit,A kit with organic solutions for pest management.,Apply solutions as directed on the package.,"Safe for crops and the environment, reduces chemical use.",500,OrganicCare,1 year,Store in a cool place,4.9,All crops,1 kg,N/A,No,18%,None,"Lettuce, Spinach",All stages,N/A
66fd2075bb1d40464e7b4cc6,Seedling Transplanter,Transplants seedlings into the field automatically.,Set up the machine with the correct spacing and depth.,Saves time and labor during the transplanting phase.,3500,TransplantPro,2 years,Clean after each use,4.8,Vegetables,50 kg,2 acres/hour,Yes,20%,Training required,"Tomato, Pepper",Transplanting Stage,"Fertile, Well-drained"
66fd2075bb1d40464e7b4cc7,Biodegradable Mulch Layer,A layer of mulch that decomposes and adds nutrients to soil.,Apply before planting and water it down.,Reduces weed growth and improves soil health.,300,EcoMulch,1 year,Replace as needed,4.5,All crops,20 kg,N/A,No,25%,None,All crops,All stages,"Well-drained, Nutrient-rich"
66fd2075bb1d40464e7b4cc8,Water-Use Efficiency System,Monitors and optimizes water usage in irrigation.,Set up sensors and connect to the irrigation system.,Reduces water waste and maximizes irrigation efficiency.,1200,AquaSmart,3 years,Monthly maintenance check,4.6,All crops,15 kg,N/A,Yes,20%,None,"Rice, Sugarcane",Growing Stage,"Moist, Well-drained"
66fd2075bb1d40464e7b4cc9,Smart Harvesting App,An app that schedules harvests based on crop readiness.,Download the app and connect to field sensors.,"Optimizes harvesting time, improving yield quality.",150,AgriApps,1 year,Update regularly,4.7,All crops,N/A,N/A,Yes,30%,Basic app training,All crops,Harvest Stage,N/A
66fd2075bb1d40464e7b4cca,Hydroponic Growing System,A system for growing plants without soil using nutrient solutions.,Set up the system with water and nutrients for optimal growth.,"Efficient use of space and water, faster plant growth.",5000,HydroTech,5 years,Regular water checks,4.9,Leafy Greens,100 kg,N/A,Yes,25%,None,"Lettuce, Basil",Growing Stage,N/A
66fd2075bb1d40464e7b4ccb,Electric Sprayer,Efficiently sprays pesticides or fertilizers over crops.,"Fill tank, adjust nozzle, and start the motor.",Reduces labor and ensures even application.,800,SprayPro,2 years,Clean after each use,4.4,All crops,10 kg,N/A,Yes,15%,Basic training required,"Grapes, Apple",All stages,N/A
66fd2075bb1d40464e7b4ccc,Soil Moisture Sensor,Monitors moisture levels in the soil to optimize irrigation.,Install in the field to measure moisture levels.,Helps conserve water and ensure proper irrigation.,600,SoilSmart,1 year,Replace batteries yearly,4.7,All crops,1 kg,N/A,Yes,20%,None,All crops,All stages,"Well-drained, Moist"
66fd2075bb1d40464e7b4ccd,Crop Rotation Planner,Software to help plan crop rotation for sustainability.,Input crop data and generate a rotation schedule.,Enhances soil health and prevents disease buildup.,400,CropTech,3 years,Regular updates required,4.8,All crops,N/A,N/A,Yes,30%,Online training available,All crops,All stages,N/A
66fd2075bb1d40464e7b4cce,Organic Soil Amendments,Natural materials to improve soil fertility.,Mix into soil before planting or as a top dressing.,Enhances nutrient content and promotes healthy growth.,250,EcoGrow,1 year,Store in a dry place,4.6,All crops,25 kg,N/A,No,22%,None,"Corn, Soybean",Growing Stage,"Fertile, Loamy"
66fd2075bb1d40464e7b4ccf,Seed Treatment Chemicals,Chemicals that protect seeds from diseases and pests.,Apply to seeds before planting.,Increases germination rates and protects young plants.,350,SeedSafe,2 years,Store in a cool place,4.5,All crops,2 kg,N/A,No,18%,None,All crops,Pre-planting Stage,N/A
66fd2075bb1d40464e7b4cd0,Automatic Irrigation System,A system that automates the watering schedule for crops.,Set up timers and moisture sensors for optimal timing.,Saves water and ensures consistent moisture levels.,2500,IrrigationPro,3 years,Monthly checks,4.9,All crops,30 kg,N/A,Yes,25%,None,All crops,All stages,"Well-drained, Moist"
66fd2075bb1d40464e7b4cd1,Fertility Testing Kit,Kit to test soil fertility and pH levels.,Follow instructions to collect soil samples and test.,"Informs farmers about nutrient needs, optimizing fertilization.",150,SoilCheck,1 year,Store in a dry place,4.6,All crops,1 kg,N/A,No,20%,None,All crops,All stages,N/A
66fd2075bb1d40464e7b4cd2,Precision Planter,A planter that optimizes seed placement for better yields.,Adjust settings for seed depth and spacing.,Maximizes crop yield and minimizes waste.,3000,PlantSmart,2 years,Regular maintenance required,4.8,"Corn, Soybean",150 kg,N/A,Yes,30%,Training required,"Corn, Wheat",Pre-planting Stage,"Fertile, Well-drained"
66fd2075bb1d40464e7b4cd3,Mobile Crop Advisor App,An app providing farming tips based on crop type.,Download and enter crop information for advice.,Access to real-time advice and best practices.,50,AgriApps,1 year,Regular updates required,4.7,All crops,N/A,N/A,Yes,35%,Basic app training,All crops,All stages,N/A
66fd2075bb1d40464e7b4cd4,Cover Crop Seeder,A tool to plant cover crops to improve soil health.,Set up the seeder according to the cover crop variety.,Enhances soil structure and prevents erosion.,2200,CoverTech,3 years,Regular checks,4.5,All crops,200 kg,N/A,Yes,20%,None,All crops,Pre-planting Stage,"Fertile, Well-drained"
66fd2075bb1d40464e7b4cd5,Grain Moisture Meter,Measures moisture content in harvested grains.,Calibrate before use and measure moisture levels.,Ensures proper storage and prevents spoilage.,800,GrainTech,2 years,Battery replacement yearly,4.6,All crops,1 kg,N/A,Yes,25%,None,"Rice, Wheat",Post-harvest Stage,N/A
66fd2075bb1d40464e7b4cd6,Tracked Tractor,A tractor designed for heavy-duty tasks on uneven terrain.,Operate according to manufacturer guidelines.,Improved traction and stability in challenging conditions.,50000,FarmMachinery,5 years,Regular maintenance checks,4.7,All crops,2000 kg,N/A,Yes,20%,Training required,All crops,All stages,N/A
66fd2075bb1d40464e7b4cd7,Organic Fertilizer Spreader,Spreads organic fertilizers across the field.,Fill with organic fertilizer and set the desired spread rate.,Eco-friendly fertilization method.,1200,OrganicFarm,2 years,Clean after each use,4.8,All crops,100 kg,1 acre/hour,Yes,25%,None,All crops,All stages,"Fertile, Well-drained"
66fd2075bb1d40464e7b4cd8,Handheld Soil Tester,Portable tester for quick soil health checks.,Follow instructions to take soil samples and test.,Immediate feedback on soil conditions.,100,SoilPro,1 year,Clean after each use,4.6,All crops,0.5 kg,N/A,No,30%,None,All crops,All stages,N/A
66fd2075bb1d40464e7b4cd9,Greenhouse Kits,Kits for setting up a small greenhouse for crops.,Follow assembly instructions and set up in sunlight.,Extends growing season and protects from harsh weather.,3000,GrowTech,2 years,Regular checks,4.9,"Vegetables, Herbs",150 kg,N/A,Yes,20%,Basic assembly training,"Tomato, Basil",Growing Stage,N/A
66fd2075bb1d40464e7b4cda,Thermal Imaging Camera,Used for monitoring plant health and water stress.,Scan fields for temperature differences.,Identifies stressed plants for targeted intervention.,2500,ImageTech,3 years,Regular software updates,4.8,All crops,1 kg,N/A,Yes,25%,Advanced training required,All crops,All stages,N/A
